{
  "schema_version": "0.2",
  "contract_kind": "pirb_outcome_metric_definition",
  "metric_id": "pirb-metric-fictional-essential-service-gap",
  "version": 1,
  "status": "active",
  "name": "Fictional essential-service gap by community and service period",
  "purpose": "Demonstrate that service-gap outcomes are defined, versioned, challengeable, and reported with distributional effects visible.",
  "unit": "fictional unmet service units per declared service period",
  "direction": "lower_is_better",
  "population_scope": {
    "description": "Four fictional communities in a bounded service network.",
    "inclusion_rule": "Include all four named aggregate community units for each complete service period.",
    "exclusion_rule": "Exclude no community without a versioned, documented and reviewable reason."
  },
  "geographic_scope": {
    "scope_description": "Fictional hub with three connected neighboring communities.",
    "boundary_reference": "synthetic:network-boundary:v1",
    "coverage_complete": true,
    "unassessed_scope_handling": "review_required"
  },
  "measurement_window": {
    "start": "2026-10-01T00:00:00Z",
    "end": "2026-10-08T00:00:00Z",
    "time_basis": "UTC interval; local reporting window must be specified in an actual field protocol."
  },
  "denominator": {
    "description": "One complete service period per declared community.",
    "unit": "community-service-period",
    "source_reference": "synthetic:service-period-register:v1"
  },
  "missingness_policy": "unknown_not_zero",
  "aggregation_policy": "disaggregate_then_aggregate",
  "disaggregation_policy": {
    "approved_dimensions": [
      "community_aggregate",
      "service_period"
    ],
    "minimum_cell_size": 1,
    "suppression_rule": "Example only; suppress or coarsen any publication whose combination of dimensions could identify vulnerable people or infrastructure.",
    "policy_reference": "synthetic:privacy-policy:v1"
  },
  "authority": {
    "authority_reference": "synthetic:community-service-council",
    "mandate_evidence_references": [
      "synthetic:mandate-record:v1"
    ],
    "decision_scope": "Approve the fictional indicator definition and reporting scope only.",
    "review_authority_reference": "synthetic:independent-review-panel"
  },
  "approval": {
    "state": "approved",
    "approving_authority_reference": "synthetic:community-service-council",
    "approved_at": "2026-09-25T12:00:00Z",
    "consultation_reference": "synthetic:consultation-summary:v1",
    "dissent_record_reference": "synthetic:protected-dissent-summary:v1",
    "safe_dissent_recording_available": true
  },
  "challenge_policy": {
    "challenge_route_reference": "synthetic:challenge-channel:v1",
    "appeal_authority_reference": "synthetic:independent-review-panel",
    "response_window_hours": 72,
    "withdrawal_supported": true,
    "nonparticipation_is_not_assent": true
  },
  "version_control": {
    "predecessor_version": null,
    "effective_from": "2026-10-01T00:00:00Z",
    "effective_until": null,
    "outcomes_observed": false,
    "preregistration_reference": "synthetic:preregistration-record:v1",
    "amendment_reason": null,
    "preserve_prior_versions": true
  },
  "claim_ceiling": {
    "evidence_class": "synthetic",
    "permitted_claims": [
      "Schema example is structurally complete.",
      "The example illustrates versioned, scoped outcome governance."
    ],
    "prohibited_claims": [
      "No actual service-delivery result is evidenced.",
      "No causal improvement or peace impact is established.",
      "This example does not establish community legitimacy or deployment readiness."
    ]
  },
  "governance_events": [
    {
      "event_id": "event-proposed-v1",
      "event_type": "proposed",
      "metric_version": 1,
      "event_at": "2026-09-15T09:00:00Z",
      "actor_authority_reference": "synthetic:community-service-council",
      "evidence_references": [
        "synthetic:proposal-record:v1"
      ],
      "decision": "recorded_only"
    },
    {
      "event_id": "event-consultation-v1",
      "event_type": "consultation_opened",
      "metric_version": 1,
      "event_at": "2026-09-18T09:00:00Z",
      "actor_authority_reference": "synthetic:community-service-council",
      "evidence_references": [
        "synthetic:consultation-summary:v1"
      ],
      "decision": "recorded_only"
    },
    {
      "event_id": "event-approved-v1",
      "event_type": "approved",
      "metric_version": 1,
      "event_at": "2026-09-25T12:00:00Z",
      "actor_authority_reference": "synthetic:community-service-council",
      "evidence_references": [
        "synthetic:mandate-record:v1",
        "synthetic:protected-dissent-summary:v1"
      ],
      "decision": "accepted"
    },
    {
      "event_id": "event-activated-v1",
      "event_type": "activated",
      "metric_version": 1,
      "event_at": "2026-10-01T00:00:00Z",
      "actor_authority_reference": "synthetic:community-service-council",
      "evidence_references": [
        "synthetic:preregistration-record:v1"
      ],
      "decision": "accepted"
    }
  ]
}
